"Marcovecchio M.L.; Hendriks A.E.J.; Delfin C.; Battelino T.; Danne T.; Evans M.L.; Johannesen J.; Kaur S.; Knip M.; Overbergh L.; Pociot F.; Todd J.A.; Van der Schueren B.; Wicker L.S.; Peakman M.; Mathieu C.","Marcovecchio, M. Loredana (9243301200); Hendriks, A. Emile J. (59026453600); Delfin, Carl (57191342091); Battelino, Tadej (8726399700); Danne, Thomas (7003794125); Evans, Mark L. (57203594863); Johannesen, Jesper (7004619184); Kaur, Simranjeet (57197939526); Knip, Mikael (57204443608); Overbergh, Lut (7003372526); Pociot, Flemming (55168184400); Todd, John A. (7402060033); Van der Schueren, Bart (12753280800); Wicker, Linda S. (7005565823); Peakman, Mark (7005867806); Mathieu, Chantal (16463757000)","9243301200; 59026453600; 57191342091; 8726399700; 7003794125; 57203594863; 7004619184; 57197939526; 57204443608; 7003372526; 55168184400; 7402060033; 12753280800; 7005565823; 7005867806; 16463757000","The INNODIA Type 1 Diabetes Natural History Study: a European cohort of newly diagnosed children, adolescents and adults","2024","Diabetologia","67","6","","995","1008","13","4","10.1007/s00125-024-06124-5","https://www.scopus.com/inward/record.uri?eid=2-s2.0-85188308637&doi=10.1007%2fs00125-024-06124-5&partnerID=40&md5=6e6903b747cc3891e567191fa5d653a5","Department of Paediatrics, University of Cambridge, Cambridge, United Kingdom; Department of Paediatric Diabetes and Endocrinology, Cambridge University Hospitals NHS Foundation Trust, Cambridge, United Kingdom; Department of Pharmacometrics, Novo Nordisk A/S, Søborg, Denmark; Department of Endocrinology, Diabetes and Metabolism, University Children’s Hospital, University Medical Centre Ljubljana, Ljubljana, Slovenia; Faculty of Medicine, University of Ljubljana, Ljubljana, Slovenia; Centre for Paediatric Endocrinology, Diabetology, and Clinical Research, Auf Der Bult Children’s Hospital, Hannover, Germany; Wellcome MRC Institute of Metabolic Science, University of Cambridge, Cambridge, United Kingdom; Department of Medicine, University of Cambridge, Cambridge, United Kingdom; Translational Type 1 Diabetes Research, Clinical Research, Steno Diabetes Center Copenhagen, Herlev, Denmark; Department of Paediatrics, Copenhagen University Hospital, Herlev, Denmark; Institute of Health and Medical Sciences, University of Copenhagen, Herlev, Denmark; Research Program for Clinical and Molecular Metabolism, Faculty of Medicine, University of Helsinki, Helsinki, Finland; Pediatric Research Center, New Children’s Hospital, Helsinki University Hospital, Helsinki, Finland; Clinical and Experimental Endocrinology, Department of Chronic Diseases and Metabolism, KU Leuven, Leuven, Belgium; Centre for Human Genetics, Nuffield Department of Medicine, University of Oxford, Oxford, United Kingdom; Immunology & amp; Inflammation Research Therapeutic Area, Sanofi, MA, United States","Marcovecchio M.L., Department of Paediatrics, University of Cambridge, Cambridge, United Kingdom, Department of Paediatric Diabetes and Endocrinology, Cambridge University Hospitals NHS Foundation Trust, Cambridge, United Kingdom; Hendriks A.E.J., Department of Paediatrics, University of Cambridge, Cambridge, United Kingdom, Department of Paediatric Diabetes and Endocrinology, Cambridge University Hospitals NHS Foundation Trust, Cambridge, United Kingdom; Delfin C., Department of Pharmacometrics, Novo Nordisk A/S, Søborg, Denmark; Battelino T., Department of Endocrinology, Diabetes and Metabolism, University Children’s Hospital, University Medical Centre Ljubljana, Ljubljana, Slovenia, Faculty of Medicine, University of Ljubljana, Ljubljana, Slovenia; Danne T., Centre for Paediatric Endocrinology, Diabetology, and Clinical Research, Auf Der Bult Children’s Hospital, Hannover, Germany; Evans M.L., Wellcome MRC Institute of Metabolic Science, University of Cambridge, Cambridge, United Kingdom, Department of Medicine, University of Cambridge, Cambridge, United Kingdom; Johannesen J., Translational Type 1 Diabetes Research, Clinical Research, Steno Diabetes Center Copenhagen, Herlev, Denmark, Department of Paediatrics, Copenhagen University Hospital, Herlev, Denmark; Institute of Health and Medical Sciences, University of Copenhagen, Herlev, Denmark; Kaur S., Translational Type 1 Diabetes Research, Clinical Research, Steno Diabetes Center Copenhagen, Herlev, Denmark, Department of Paediatrics, Copenhagen University Hospital, Herlev, Denmark; Institute of Health and Medical Sciences, University of Copenhagen, Herlev, Denmark; Knip M., Research Program for Clinical and Molecular Metabolism, Faculty of Medicine, University of Helsinki, Helsinki, Finland, Pediatric Research Center, New Children’s Hospital, Helsinki University Hospital, Helsinki, Finland; Overbergh L., Clinical and Experimental Endocrinology, Department of Chronic Diseases and Metabolism, KU Leuven, Leuven, Belgium; Pociot F., Translational Type 1 Diabetes Research, Clinical Research, Steno Diabetes Center Copenhagen, Herlev, Denmark, Department of Paediatrics, Copenhagen University Hospital, Herlev, Denmark; Institute of Health and Medical Sciences, University of Copenhagen, Herlev, Denmark; Todd J.A., Centre for Human Genetics, Nuffield Department of Medicine, University of Oxford, Oxford, United Kingdom; Van der Schueren B., Clinical and Experimental Endocrinology, Department of Chronic Diseases and Metabolism, KU Leuven, Leuven, Belgium; Wicker L.S., Centre for Human Genetics, Nuffield Department of Medicine, University of Oxford, Oxford, United Kingdom; Peakman M., Immunology & amp; Inflammation Research Therapeutic Area, Sanofi, MA, United States; Mathieu C., Clinical and Experimental Endocrinology, Department of Chronic Diseases and Metabolism, KU Leuven, Leuven, Belgium","Aims/hypothesis: Type 1 diabetes is an heterogenous condition. Characterising factors explaining differences in an individual’s clinical course and treatment response will have important clinical and research implications. Our aim was to explore type 1 diabetes heterogeneity, as assessed by clinical characteristics, autoantibodies, beta cell function and glycaemic outcomes, during the first 12 months from diagnosis, and how it relates to age at diagnosis. Methods: Data were collected from the large INNODIA cohort of individuals (aged 1.0–45.0 years) newly diagnosed with type 1 diabetes, followed 3 monthly, to assess clinical characteristics, C-peptide, HbA1c and diabetes-associated antibodies, and their changes, during the first 12 months from diagnosis, across three age groups: <10 years; 10–17 years; and ≥18 years. Results: The study population included 649 individuals (57.3% male; age 12.1±8.3 years), 96.9% of whom were positive for one or more diabetes-related antibodies. Baseline (IQR) fasting C-peptide was 242.0 (139.0–382.0) pmol/l (AUC 749.3 [466.2–1106.1] pmol/l × min), with levels increasing with age (p<0.001). Over time, C-peptide remained lower in participants aged <10 years but it declined in all age groups. In parallel, glucose levels progressively increased. Lower baseline fasting C-peptide, BMI SD score and presence of diabetic ketoacidosis at diagnosis were associated with lower stimulated C-peptide over time. HbA1c decreased during the first 3 months (p<0.001), whereas insulin requirement increased from 3 months post diagnosis (p<0.001). Conclusions/interpretation: In this large cohort with newly diagnosed type 1 diabetes, we identified age-related differences in clinical and biochemical variables. Of note, C-peptide was lower in younger children but there were no main age differences in its rate of decline. Graphical Abstract: (Figure presented.). © The Author(s) 2024.","M.L. Marcovecchio; Department of Paediatrics, University of Cambridge, Cambridge, United Kingdom; email: mlm45@medschl.cam.ac.uk","","Springer Science and Business Media Deutschland GmbH","0012186X","","DBTGA","38517484","English","Diabetologia","Article","Final","All Open Access; Hybrid Gold Open Access","Scopus","2-s2.0-85188308637"
"Orman B.; Çetinkaya S.; Öner N.; Akçaboy M.; Fettah A.; Lafcı N.G.; Erdeve Ş.S.","Orman, Burçe (57696179600); Çetinkaya, Semra (7003998573); Öner, Nergiz (55065078600); Akçaboy, Meltem (14064494900); Fettah, Ali (55646055700); Lafcı, Naz Güleray (57193673210); Erdeve, Şenay Savaş (26647770800)","57696179600; 7003998573; 55065078600; 14064494900; 55646055700; 57193673210; 26647770800","Hemolytic Anemia due to Glucose 6 Phosphate Dehydrogenase Deficiency Triggered by Type 1 Diabetes Mellitus","2023","JCRPE Journal of Clinical Research in Pediatric Endocrinology","15","4","","417","420","3","1","10.4274/jcrpe.galenos.2022.2021-11-10","https://www.scopus.com/inward/record.uri?eid=2-s2.0-85137098749&doi=10.4274%2fjcrpe.galenos.2022.2021-11-10&partnerID=40&md5=9e7293c242e080ca7980fecb07faba2f","Dr. Sami Ulus Obstetrics and Gynecology, Children’s Health and Diseases Training and Research Hospital, Clinic of Pediatric Endocrinology, Ankara, Turkey; Dr. Sami Ulus Obstetrics and Gynecology, Children’s Health and Diseases Training and Research Hospital, Clinic of Pediatrics, Ankara, Turkey; Hacettepe University, Faculty of Medicine, Department of Genetics, Ankara, Turkey","Orman B., Dr. Sami Ulus Obstetrics and Gynecology, Children’s Health and Diseases Training and Research Hospital, Clinic of Pediatric Endocrinology, Ankara, Turkey; Çetinkaya S., Dr. Sami Ulus Obstetrics and Gynecology, Children’s Health and Diseases Training and Research Hospital, Clinic of Pediatric Endocrinology, Ankara, Turkey; Öner N., Dr. Sami Ulus Obstetrics and Gynecology, Children’s Health and Diseases Training and Research Hospital, Clinic of Pediatric Endocrinology, Ankara, Turkey; Akçaboy M., Dr. Sami Ulus Obstetrics and Gynecology, Children’s Health and Diseases Training and Research Hospital, Clinic of Pediatrics, Ankara, Turkey; Fettah A., Dr. Sami Ulus Obstetrics and Gynecology, Children’s Health and Diseases Training and Research Hospital, Clinic of Pediatric Endocrinology, Ankara, Turkey; Lafcı N.G., Hacettepe University, Faculty of Medicine, Department of Genetics, Ankara, Turkey; Erdeve Ş.S., Dr. Sami Ulus Obstetrics and Gynecology, Children’s Health and Diseases Training and Research Hospital, Clinic of Pediatric Endocrinology, Ankara, Turkey","Glucose 6 phosphate dehydrogenase (G6PD) is expressed in all tissues and is necessary to maintain oxidant stress capacity of cells. G6PD deficiency is the most common enzymopathy in humans and is among the important causes of hemolytic anemia. It has been reported that severe hemolytic anemia due to G6PD deficiency may develop in newly diagnosed diabetes, especially during the correction of hyperglycemia. To date, nine cases have been published. Genetic analysis was not performed for G6PD deficiency in these published patients. We present a case of hemolytic anemia due to G6PD deficiency secondary to newly diagnosed type 1 diabetes mellitus. Genetic testing was performed for the index patient and revealed a previously reported missense pathogenic variant (c.653C>T; p.Ser218Phe) in the G6PD gene. © 2023 by Turkish Society for Pediatric Endocrinology and Diabetes.","B. Orman; Dr. Sami Ulus Obstetrics and Gynecology, Children’s Health and Diseases Training and Research Hospital, Clinic of Pediatric Endocrinology, Ankara, Turkey; email: burceayvazoglu@gmail.com","","Galenos Publishing House","13085727","","","35306802","English","JCRPE J. Clin. Res. Pediatr. Endocrinol.","Article","Final","All Open Access; Gold Open Access","Scopus","2-s2.0-85137098749"
"Koskinen M.K.; Mikk M.-L.; Laine A.-P.; Lempainen J.; Löyttyniemi E.; Vähäsalo P.; Hekkala A.; Härkönen T.; Kiviniemi M.; Simell O.; Knip M.; Veijola R.; Ilonen J.; Toppari J.","Koskinen, Maarit K. (57119258200); Mikk, Mari-Liis (55962615500); Laine, Antti-Pekka (7101684870); Lempainen, Johanna (26634103800); Löyttyniemi, Eliisa (6602373845); Vähäsalo, Paula (6603663095); Hekkala, Anne (8847557200); Härkönen, Taina (6603713513); Kiviniemi, Minna (57207904354); Simell, Olli (7101750903); Knip, Mikael (57204443608); Veijola, Riitta (6603765826); Ilonen, Jorma (7103356970); Toppari, Jorma (35479112600)","57119258200; 55962615500; 7101684870; 26634103800; 6602373845; 6603663095; 8847557200; 6603713513; 57207904354; 7101750903; 57204443608; 6603765826; 7103356970; 35479112600","Longitudinal pattern of first-phase insulin response is associated with genetic variants outside the class II HLA region in children with multiple autoantibodies","2020","Diabetes","69","1","","12","19","7","20","10.2337/db19-0329","https://www.scopus.com/inward/record.uri?eid=2-s2.0-85077016824&doi=10.2337%2fdb19-0329&partnerID=40&md5=6ec04c78d3778e3b941d1b4a3bad0bb9","Department of Pediatrics, University of Turku and Turku University Hospital, Turku, Finland; Medicity University of Turku, Turku, Finland; Immunogenetics Laboratory, Institute of Biomedicine, University of Turku and Clinical Microbiology, Turku, Finland; Department of Biostatistics, University of Turku, Turku, Finland; Department of Pediatrics, PEDEGO Research Unit, Oulu University Hospital and University of Oulu, Oulu, Finland; Children's Hospital, University of Helsinki and Helsinki University Hospital, Helsinki, Finland; Research Program for Clinical and Molecular Metabolism, Faculty of Medicine, University of Helsinki, Helsinki, Finland; Folkhälsan Research Center, Helsinki, Finland; Tampere Center for Child Health Research, Tampere University Hospital, Tampere, Finland; Institute of Biomedicine, Research Centre for Integrative Physiology and Pharmacology, University of Turku, Turku, Finland","Koskinen M.K., Department of Pediatrics, University of Turku and Turku University Hospital, Turku, Finland, Medicity University of Turku, Turku, Finland; Mikk M.-L., Immunogenetics Laboratory, Institute of Biomedicine, University of Turku and Clinical Microbiology, Turku, Finland; Laine A.-P., Immunogenetics Laboratory, Institute of Biomedicine, University of Turku and Clinical Microbiology, Turku, Finland; Lempainen J., Department of Pediatrics, University of Turku and Turku University Hospital, Turku, Finland, Immunogenetics Laboratory, Institute of Biomedicine, University of Turku and Clinical Microbiology, Turku, Finland; Löyttyniemi E., Department of Biostatistics, University of Turku, Turku, Finland; Vähäsalo P., Department of Pediatrics, PEDEGO Research Unit, Oulu University Hospital and University of Oulu, Oulu, Finland; Hekkala A., Department of Pediatrics, PEDEGO Research Unit, Oulu University Hospital and University of Oulu, Oulu, Finland; Härkönen T., Children's Hospital, University of Helsinki and Helsinki University Hospital, Helsinki, Finland, Research Program for Clinical and Molecular Metabolism, Faculty of Medicine, University of Helsinki, Helsinki, Finland; Kiviniemi M., Immunogenetics Laboratory, Institute of Biomedicine, University of Turku and Clinical Microbiology, Turku, Finland; Simell O., Department of Pediatrics, University of Turku and Turku University Hospital, Turku, Finland; Knip M., Children's Hospital, University of Helsinki and Helsinki University Hospital, Helsinki, Finland, Research Program for Clinical and Molecular Metabolism, Faculty of Medicine, University of Helsinki, Helsinki, Finland, Folkhälsan Research Center, Helsinki, Finland, Tampere Center for Child Health Research, Tampere University Hospital, Tampere, Finland; Veijola R., Department of Pediatrics, PEDEGO Research Unit, Oulu University Hospital and University of Oulu, Oulu, Finland; Ilonen J., Immunogenetics Laboratory, Institute of Biomedicine, University of Turku and Clinical Microbiology, Turku, Finland; Toppari J., Department of Pediatrics, University of Turku and Turku University Hospital, Turku, Finland, Institute of Biomedicine, Research Centre for Integrative Physiology and Pharmacology, University of Turku, Turku, Finland","A declining first-phase insulin response (FPIR) is associated with positivity for multiple islet autoantibodies, irrespective of class II HLA DR-DQ genotype. We examined the associations of FPIR with genetic variants outside the HLA DR-DQ region in the Finnish Type 1 Diabetes Prediction and Prevention (DIPP) study in children with and without multiple autoantibodies. Association between FPIR and class I alleles A*24 and B*39 and eight single nucleotide polymorphisms outside the HLA region were analyzed in 438 children who had one or more FPIR results available after seroconversion. Hierarchical linear mixed models were used to analyze repeated measurements of FPIR. In children with multiple autoantibodies, the change in FPIR over time was significantly different between those with various PTPN2 (rs45450798), FUT2 (rs601338), CTSH (rs3825932), and IKZF4 (rs1701704) genotypes in at least one of the models. In general, children carrying susceptibility alleles for type 1 diabetes experienced a more rapid decline in insulin secretion compared with children without susceptibility alleles. The presence of the class I HLA A∗24 allele was also associated with a steeper decline of FPIR over time in children with multiple autoantibodies. Certain genetic variants outside the class II HLA region may have a significant impact on the longitudinal pattern of FPIR. © 2019 by the American Diabetes Association.","M.K. Koskinen; Department of Pediatrics, University of Turku and Turku University Hospital, Turku, Finland; email: maarit.koskinen@utu.fi","","American Diabetes Association Inc.","00121797","","DIAEA","31591105","English","Diabetes","Article","Final","All Open Access; Bronze Open Access; Green Open Access","Scopus","2-s2.0-85077016824"
"Hasebe M.; Iwasaki Y.; Keidai Y.; Iwasaki K.; Honjo S.; Hamasaki A.","Hasebe, Masashi (57434160100); Iwasaki, Yorihiro (57212333996); Keidai, Yamato (57209881590); Iwasaki, Kanako (56225575800); Honjo, Sachiko (13905118300); Hamasaki, Akihiro (6603828614)","57434160100; 57212333996; 57209881590; 56225575800; 13905118300; 6603828614","Plant sterol hyperabsorption caused by uncontrolled diabetes in a patient with a heterozygous ABCG5 variant","2022","Journal of Diabetes Investigation","13","11","","1934","1938","4","0","10.1111/jdi.13874","https://www.scopus.com/inward/record.uri?eid=2-s2.0-85134522300&doi=10.1111%2fjdi.13874&partnerID=40&md5=d62bd01a558ff7dda4ca74cc9393a50e","Department of Diabetes and Endocrinology, Tazuke Kofukai Medical Research Institute, Kitano Hospital, Osaka, Japan; Endocrine Unit, Department of Medicine, Massachusetts General Hospital and Harvard Medical School, Boston, MA, United States; Department of Diabetes, Endocrinology and Nutrition, Kyoto University Graduate School of Medicine, Kyoto, Japan","Hasebe M., Department of Diabetes and Endocrinology, Tazuke Kofukai Medical Research Institute, Kitano Hospital, Osaka, Japan; Iwasaki Y., Department of Diabetes and Endocrinology, Tazuke Kofukai Medical Research Institute, Kitano Hospital, Osaka, Japan, Endocrine Unit, Department of Medicine, Massachusetts General Hospital and Harvard Medical School, Boston, MA, United States; Keidai Y., Department of Diabetes and Endocrinology, Tazuke Kofukai Medical Research Institute, Kitano Hospital, Osaka, Japan, Department of Diabetes, Endocrinology and Nutrition, Kyoto University Graduate School of Medicine, Kyoto, Japan; Iwasaki K., Department of Diabetes and Endocrinology, Tazuke Kofukai Medical Research Institute, Kitano Hospital, Osaka, Japan; Honjo S., Department of Diabetes and Endocrinology, Tazuke Kofukai Medical Research Institute, Kitano Hospital, Osaka, Japan; Hamasaki A., Department of Diabetes and Endocrinology, Tazuke Kofukai Medical Research Institute, Kitano Hospital, Osaka, Japan","Plant sterol intake is widely recommended for patients with cardiovascular risk factors based on the inhibitory effect on intestinal cholesterol absorption. Although plant sterols, once absorbed, can promote atherosclerosis, their intake is believed to be safe because of poor absorption, except in rare hyperabsorbers with homozygous ABCG5/8 mutations. We report a case of new-onset type 1 diabetes accompanied by hypercholesterolemia. At the initial presentation with diabetic ketoacidosis, the patient showed marked hypercholesterolemia. Whole-exome sequencing revealed a heterozygous pathogenic variant in ABCG5 (p.R419H). The initial serum plant sterol levels were markedly high (sitosterol 32.5 μg/mL, campesterol 66.0 μg/mL), close to the range observed in patients with homozygous ABCG5/8 mutations, which were largely reduced by insulin treatment without ezetimibe. The addition of ezetimibe normalized plant sterol levels. These findings provide the first evidence that uncontrolled diabetes plays a causal role in the pathogenesis of phytosterolemia. © 2022 The Authors. Journal of Diabetes Investigation published by Asian Association for the Study of Diabetes (AASD) and John Wiley & Sons Australia, Ltd.","A. Hamasaki; Department of Diabetes and Endocrinology, Tazuke Kofukai Medical Research Institute, Kitano Hospital, Osaka, Japan; email: a-hamasaki@kitano-hp.or.jp","","John Wiley and Sons Inc","20401116","","","35730985","English","J. Diabetes Invest.","Article","Final","All Open Access; Green Open Access","Scopus","2-s2.0-85134522300"
