"Onuma H.; Kawamura R.; Tabara Y.; Yamashita M.; Ohashi J.; Kawasaki E.; Imagawa A.; Yamada Y.; Chujo D.; Takahashi K.; Suehiro T.; Takata Y.; Osawa H.; Makino H.","Onuma, Hiroshi (56017799200); Kawamura, Ryoichi (7006734707); Tabara, Yasuharu (6602828644); Yamashita, Masakatsu (7403598395); Ohashi, Jun (24280137300); Kawasaki, Eiji (7006090230); Imagawa, Akihisa (57722378900); Yamada, Yuya (55471424500); Chujo, Daisuke (6507986536); Takahashi, Kenji (55750474600); Suehiro, Tadashi (7103054243); Takata, Yasunori (7102282442); Osawa, Haruhiko (7102324244); Makino, Hideichi (7402754829)","56017799200; 7006734707; 6602828644; 7403598395; 24280137300; 7006090230; 57722378900; 55471424500; 6507986536; 55750474600; 7103054243; 7102282442; 7102324244; 7402754829","Variants in the BACH2 and CLEC16A gene might be associated with susceptibility to insulin-triggered type 1 diabetes","2019","Journal of Diabetes Investigation","10","6","","1447","1453","6","9","10.1111/jdi.13057","https://www.scopus.com/inward/record.uri?eid=2-s2.0-85074268470&doi=10.1111%2fjdi.13057&partnerID=40&md5=f46c3e2de5ae5c2bc93bd97fcd365dc0","Department of Diabetes and Molecular Genetics, Ehime University Graduate School of Medicine, To-on, Ehime, Japan; Department of Diabetes, Endocrine and Metabolic Disease, Tokyo Women's Medical University Yachiyo Medical Center, Yachiyo, Chiba, Japan; Center for Genomic Medicine, Kyoto University Graduate School of Medicine, Kyoto, Japan; Department of Immunology, Ehime University Graduate School of Medicine, To-on, Ehime, Japan; Department of Biological Sciences, Graduate School of Science, The University of Tokyo, Tokyo, Japan; Department of Diabetes and Endocrinology, Shin-Koga Hospital, Kurume, Fukuoka, Japan; Department of Internal Medicine (I), Osaka Medical College, Takatsuki, Osaka, Japan; Department of Endocrinology and Metabolism, Sumitomo Hospital, Osaka, Japan; Department of Diabetes, Endocrinology and Metabolism, National Center for Global Health and Medicine, Tokyo, Japan; Department of Internal Medicine, Diabetes Division, Kurashiki Central Hospital, Kurashiki, Okayama, Japan; Department of Diabetes, Kochi Takasu Hospital, Kochi, Kochi, Japan; Shiraishi Hospital Diabetes Center, Imabari, Ehime, Japan","Onuma H., Department of Diabetes and Molecular Genetics, Ehime University Graduate School of Medicine, To-on, Ehime, Japan, Department of Diabetes, Endocrine and Metabolic Disease, Tokyo Women's Medical University Yachiyo Medical Center, Yachiyo, Chiba, Japan; Kawamura R., Department of Diabetes and Molecular Genetics, Ehime University Graduate School of Medicine, To-on, Ehime, Japan; Tabara Y., Center for Genomic Medicine, Kyoto University Graduate School of Medicine, Kyoto, Japan; Yamashita M., Department of Immunology, Ehime University Graduate School of Medicine, To-on, Ehime, Japan; Ohashi J., Department of Biological Sciences, Graduate School of Science, The University of Tokyo, Tokyo, Japan; Kawasaki E., Department of Diabetes and Endocrinology, Shin-Koga Hospital, Kurume, Fukuoka, Japan; Imagawa A., Department of Internal Medicine (I), Osaka Medical College, Takatsuki, Osaka, Japan; Yamada Y., Department of Endocrinology and Metabolism, Sumitomo Hospital, Osaka, Japan; Chujo D., Department of Diabetes, Endocrinology and Metabolism, National Center for Global Health and Medicine, Tokyo, Japan; Takahashi K., Department of Internal Medicine, Diabetes Division, Kurashiki Central Hospital, Kurashiki, Okayama, Japan; Suehiro T., Department of Diabetes, Kochi Takasu Hospital, Kochi, Kochi, Japan; Takata Y., Department of Diabetes and Molecular Genetics, Ehime University Graduate School of Medicine, To-on, Ehime, Japan; Osawa H., Department of Diabetes and Molecular Genetics, Ehime University Graduate School of Medicine, To-on, Ehime, Japan; Makino H., Department of Diabetes and Molecular Genetics, Ehime University Graduate School of Medicine, To-on, Ehime, Japan, Shiraishi Hospital Diabetes Center, Imabari, Ehime, Japan","Aim/Introduction: Insulin administration was found to trigger type 1 diabetes in six Japanese type 2 diabetes patients with type 1 diabetes high-risk human leukocyte antigen class II and the class I allele of the insulin gene variable number tandem repeat genotype. The objective of the present study was to assess the contribution of non-human leukocyte antigen single-nucleotide polymorphisms (SNPs) to the risk of developing insulin-triggered type 1 diabetes. Materials and Methods: We genotyped 13 type 1 diabetes susceptible SNPs in six patients and compared them with those in Japanese controls (Hap Map3-JPT). The SNPs that showed statistically significant results were further analyzed using non-diabetic control participants and participants with type 2 diabetes at the Ehime University Hospital. Results: The risk allele frequency of BACH2 rs3757247 in the six patients was significantly more frequent than that in 86 Japanese controls (P = 0.038). No significant difference in the allele frequency was observed in the other SNPs. This result was confirmed by the findings that the risk allele frequency of BACH2 in the six patients was significantly higher than that in the non-diabetic control participants (n = 179) and type 2 diabetes with or without insulin treatment (n = 154 or n = 152; P = 0.035, 0.034 or 0.037, respectively). Despite being statistically not significant, the six patients were all homozygous for the CLEC16A rs12708716 risk allele and five were homozygous for the CLEC16A rs2903692 risk allele. Conclusions: In addition to type 1 diabetes high-risk human leukocyte antigen class II and the class I allele of the insulin gene variable number tandem repeat genotype, the possibility that the risk variants of BACH2 and CLEC16A could contribute to the development of insulin-triggered type 1 diabetes cannot be excluded. © 2019 The Authors. Journal of Diabetes Investigation published by Asian Association for the Study of Diabetes (AASD) and John Wiley & Sons Australia, Ltd","H. Onuma; Department of Diabetes and Molecular Genetics, Ehime University Graduate School of Medicine, To-on, Japan; email: onuma.hiroshi@twmu.ac.jp","","Blackwell Publishing","20401116","","","30970177","English","J. Diabetes Invest.","Article","Final","All Open Access; Gold Open Access","Scopus","2-s2.0-85074268470"
"Akil A.A.-S.; Yassin E.; Al-Maraghi A.; Aliyev E.; Al-Malki K.; Fakhro K.A.","Akil, Ammira Al-Shabeeb (57220402404); Yassin, Esraa (57219855968); Al-Maraghi, Aljazi (57218336630); Aliyev, Elbay (57218631888); Al-Malki, Khulod (57222718594); Fakhro, Khalid A. (42761091300)","57220402404; 57219855968; 57218336630; 57218631888; 57222718594; 42761091300","Diagnosis and treatment of type 1 diabetes at the dawn of the personalized medicine era","2021","Journal of Translational Medicine","19","1","137","","","","54","10.1186/s12967-021-02778-6","https://www.scopus.com/inward/record.uri?eid=2-s2.0-85103806532&doi=10.1186%2fs12967-021-02778-6&partnerID=40&md5=1b38564d8b1a73bd75094749dd8a5c66","Department of Human Genetics-Precision Medicine Program, Sidra Medicine, P.O. Box 26999, Doha, Qatar; Department of Genetic Medicine, Weill Cornell Medicine, P.O. Box 24144, Doha, Qatar; College of Health and Life Sciences, Hamad Bin Khalifa University, P.O. Box 34110, Doha, Qatar","Akil A.A.-S., Department of Human Genetics-Precision Medicine Program, Sidra Medicine, P.O. Box 26999, Doha, Qatar; Yassin E., Department of Human Genetics-Precision Medicine Program, Sidra Medicine, P.O. Box 26999, Doha, Qatar; Al-Maraghi A., Department of Human Genetics-Precision Medicine Program, Sidra Medicine, P.O. Box 26999, Doha, Qatar; Aliyev E., Department of Human Genetics-Precision Medicine Program, Sidra Medicine, P.O. Box 26999, Doha, Qatar; Al-Malki K., Department of Human Genetics-Precision Medicine Program, Sidra Medicine, P.O. Box 26999, Doha, Qatar; Fakhro K.A., Department of Human Genetics-Precision Medicine Program, Sidra Medicine, P.O. Box 26999, Doha, Qatar, Department of Genetic Medicine, Weill Cornell Medicine, P.O. Box 24144, Doha, Qatar, College of Health and Life Sciences, Hamad Bin Khalifa University, P.O. Box 34110, Doha, Qatar","Type 1 diabetes affects millions of people globally and requires careful management to avoid serious long-term complications, including heart and kidney disease, stroke, and loss of sight. The type 1 diabetes patient cohort is highly heterogeneous, with individuals presenting with disease at different stages and severities, arising from distinct etiologies, and overlaying varied genetic backgrounds. At present, the “one-size-fits-all” treatment for type 1 diabetes is exogenic insulin substitution therapy, but this approach fails to achieve optimal blood glucose control in many individuals. With advances in our understanding of early-stage diabetes development, diabetes stratification, and the role of genetics, type 1 diabetes is a promising candidate for a personalized medicine approach, which aims to apply “the right therapy at the right time, to the right patient”. In the case of type 1 diabetes, great efforts are now being focused on risk stratification for diabetes development to enable pre-clinical detection, and the application of treatments such as gene therapy, to prevent pancreatic destruction in a sub-set of patients. Alongside this, breakthroughs in stem cell therapies hold great promise for the regeneration of pancreatic tissues in some individuals. Here we review the recent initiatives in the field of personalized medicine for type 1 diabetes, including the latest discoveries in stem cell and gene therapy for the disease, and current obstacles that must be overcome before the dream of personalized medicine for all type 1 diabetes patients can be realized. © 2021, The Author(s).","A.A.-S. Akil; Department of Human Genetics-Precision Medicine Program, Sidra Medicine, Doha, P.O. Box 26999, Qatar; email: aakil@sidra.org","","BioMed Central Ltd","14795876","","","33794915","English","J. Transl. Med.","Review","Final","All Open Access; Gold Open Access; Green Open Access","Scopus","2-s2.0-85103806532"
"Pozzilli P.; Pieralice S.","Pozzilli, Paolo (7102395063); Pieralice, Silvia (57203553966)","7102395063; 57203553966","Latent autoimmune diabetes in adults: Current status and new horizons","2018","Endocrinology and Metabolism","33","2","","147","159","12","64","10.3803/EnM.2018.33.2.147","https://www.scopus.com/inward/record.uri?eid=2-s2.0-85052610090&doi=10.3803%2fEnM.2018.33.2.147&partnerID=40&md5=0ca9144f561c2f694f1b68dfdaab47cb","Department of Endocrinology and Diabetes, University Campus Bio-Medico, Rome, Italy; Centre of Immunobiology, Blizard Institute, Barts and the London School of Medicine, Queen Mary, University of London, London, United Kingdom","Pozzilli P., Department of Endocrinology and Diabetes, University Campus Bio-Medico, Rome, Italy, Centre of Immunobiology, Blizard Institute, Barts and the London School of Medicine, Queen Mary, University of London, London, United Kingdom; Pieralice S., Department of Endocrinology and Diabetes, University Campus Bio-Medico, Rome, Italy","Autoimmune diabetes is a heterogeneous disease which can arise at any age. Subjects with adult-onset autoimmune diabetes who do not necessitate insulin-therapy for at least 6 months after diagnosis are demarcated as having latent autoimmune diabetes in adults (LADA). This condition is more heterogeneous than young-onset autoimmune diabetes and shares clinical and metabolic characteristics with both type 2 and type 1 diabetes. Patients with LADA are considered by having highly variable β-cell destruction, different degrees of insulin resistance and heterogeneous titre and pattern of islet autoantibody, suggesting different pathophysiological pathways partially explaining the heterogeneous phenotypes of LADA. To date the heterogeneity of LADA does not allow to establish a priori treatment algorithm and no specific guidelines for LADA therapy are available. These subjects are mostly treated as affected by type 2 diabetes, a factor that might lead to the progression to insulin-dependency quickly. A personalised medicine approach is necessary to attain optimal metabolic control and preserve β-cell function to decrease the risk of long-term diabetes complications. Recent data concerning the use of oral antidiabetic agents as dipeptidyl peptidase 4 inhibitors and glucagon-like peptide 1 receptor agonists indicate up-and-coming results in term of protect C-peptide levels and improving glycaemic control. This review summarises current knowledge on LADA, emphasising controversies regarding its pathophysiology and clinical features. Moreover, we discuss data available about novel therapeutic approaches that can be considered for prevention of β-cell loss in LADA. © 2018 Korean Endocrine Society.","P. Pozzilli; Department of Endocrinology and Diabetes, University Campus Bio-Medico, Rome, Via Alvaro del Portillo 21, 00128, Italy; email: p.pozzilli@unicampus.it","","Korean Endocrine Society","2093596X","","","","English","Endocrinol. Metab.","Review","Final","All Open Access; Gold Open Access; Green Open Access","Scopus","2-s2.0-85052610090"
"Poulsen C.S.; Hesse D.; Fernandes G.R.; Hansen T.H.; Kern T.; Linneberg A.; Van Espen L.; Jørgensen T.; Nielsen T.; Alibegovic A.C.; Matthijnssens J.; Pedersen O.; Vestergaard H.; Hansen T.; Andersen M.K.","Poulsen, Casper S. (56549652000); Hesse, Dan (58980157700); Fernandes, Gabriel R. (35960115500); Hansen, Tue H. (56090385500); Kern, Timo (57200400839); Linneberg, Allan (57211892948); Van Espen, Lore (57202469544); Jørgensen, Torben (57203072655); Nielsen, Trine (7201759661); Alibegovic, Amra C. (22984490100); Matthijnssens, Jelle (10144674500); Pedersen, Oluf (35373396900); Vestergaard, Henrik (7005713272); Hansen, Torben (57199388397); Andersen, Mette K. (57201517306)","56549652000; 58980157700; 35960115500; 56090385500; 57200400839; 57211892948; 57202469544; 57203072655; 7201759661; 22984490100; 10144674500; 35373396900; 7005713272; 57199388397; 57201517306","Characterization of the gut bacterial and viral microbiota in latent autoimmune diabetes in adults","2024","Scientific Reports","14","1","8315","","","","0","10.1038/s41598-024-58985-w","https://www.scopus.com/inward/record.uri?eid=2-s2.0-85189966361&doi=10.1038%2fs41598-024-58985-w&partnerID=40&md5=a41a4a59ee6abbf512003d1c72cdda8b","The Novo Nordisk Foundation Center for Basic Metabolic Research, Faculty of Health and Medical Sciences, University of Copenhagen, Copenhagen, Denmark; Steno Diabetes Center Copenhagen, Gentofte, Denmark; Novo Nordisk A/S, Soeborg, Denmark; Biosystems Informatics, Institute René Rachou-Fiocruz Minas, Belo Horizonte, Brazil; Clinical Microbiomics A/S, Copenhagen, Denmark; Center for Clinical Research and Prevention, Bispebjerg and Frederiksberg Hospital, The Capital Region, Copenhagen, Denmark; Department of Clinical Medicine, Faculty of Health and Medical Sciences, University of Copenhagen, Copenhagen, Denmark; Department of Microbiology, Immunology & amp; Transplantation, Rega Institute, Laboratory of Clinical & amp; Epidemiological Virology, KU Leuven, Leuven, Belgium; Department of Public Health, Faculty of Health and Medical Sciences, University of Copenhagen, Copenhagen, Denmark; Center for Clinical Metabolic Research, Department of Medicine, Gentofte University Hospital, Copenhagen, Denmark; Department of Medicine, Bornholms Hospital, Rønne, Denmark","Poulsen C.S., The Novo Nordisk Foundation Center for Basic Metabolic Research, Faculty of Health and Medical Sciences, University of Copenhagen, Copenhagen, Denmark; Hesse D., Steno Diabetes Center Copenhagen, Gentofte, Denmark, Novo Nordisk A/S, Soeborg, Denmark; Fernandes G.R., Biosystems Informatics, Institute René Rachou-Fiocruz Minas, Belo Horizonte, Brazil; Hansen T.H., The Novo Nordisk Foundation Center for Basic Metabolic Research, Faculty of Health and Medical Sciences, University of Copenhagen, Copenhagen, Denmark; Kern T., The Novo Nordisk Foundation Center for Basic Metabolic Research, Faculty of Health and Medical Sciences, University of Copenhagen, Copenhagen, Denmark, Clinical Microbiomics A/S, Copenhagen, Denmark; Linneberg A., Center for Clinical Research and Prevention, Bispebjerg and Frederiksberg Hospital, The Capital Region, Copenhagen, Denmark, Department of Clinical Medicine, Faculty of Health and Medical Sciences, University of Copenhagen, Copenhagen, Denmark; Van Espen L., Department of Microbiology, Immunology & amp; Transplantation, Rega Institute, Laboratory of Clinical & amp; Epidemiological Virology, KU Leuven, Leuven, Belgium; Jørgensen T., Center for Clinical Research and Prevention, Bispebjerg and Frederiksberg Hospital, The Capital Region, Copenhagen, Denmark, Department of Public Health, Faculty of Health and Medical Sciences, University of Copenhagen, Copenhagen, Denmark; Nielsen T., The Novo Nordisk Foundation Center for Basic Metabolic Research, Faculty of Health and Medical Sciences, University of Copenhagen, Copenhagen, Denmark; Alibegovic A.C., Steno Diabetes Center Copenhagen, Gentofte, Denmark, Novo Nordisk A/S, Soeborg, Denmark; Matthijnssens J., Department of Microbiology, Immunology & amp; Transplantation, Rega Institute, Laboratory of Clinical & amp; Epidemiological Virology, KU Leuven, Leuven, Belgium; Pedersen O., The Novo Nordisk Foundation Center for Basic Metabolic Research, Faculty of Health and Medical Sciences, University of Copenhagen, Copenhagen, Denmark, Center for Clinical Metabolic Research, Department of Medicine, Gentofte University Hospital, Copenhagen, Denmark; Vestergaard H., The Novo Nordisk Foundation Center for Basic Metabolic Research, Faculty of Health and Medical Sciences, University of Copenhagen, Copenhagen, Denmark, Steno Diabetes Center Copenhagen, Gentofte, Denmark, Department of Medicine, Bornholms Hospital, Rønne, Denmark; Hansen T., The Novo Nordisk Foundation Center for Basic Metabolic Research, Faculty of Health and Medical Sciences, University of Copenhagen, Copenhagen, Denmark; Andersen M.K., The Novo Nordisk Foundation Center for Basic Metabolic Research, Faculty of Health and Medical Sciences, University of Copenhagen, Copenhagen, Denmark","Latent autoimmune diabetes in adults (LADA) is a heterogeneous disease characterized by autoantibodies against insulin producing pancreatic beta cells and initial lack of need for insulin treatment. The aim of the present study was to investigate if individuals with LADA have an altered gut microbiota relative to non-diabetic control subjects, individuals with type 1 diabetes (T1D), and individuals with type 2 diabetes (T2D). Bacterial community profiling was performed with primers targeting the variable region 4 of the 16S rRNA gene and sequenced. Amplicon sequence variants (ASVs) were generated with DADA2 and annotated to the SILVA database. The gut virome was sequenced, using a viral particle enrichment and metagenomics approach, assembled, and quantified to describe the composition of the viral community. Comparison of the bacterial alpha- and beta-diversity measures revealed that the gut bacteriome of individuals with LADA resembled that of individuals with T2D. Yet, specific genera were found to differ in abundance in individuals with LADA compared with T1D and T2D, indicating that LADA has unique taxonomical features. The virome composition reflected the stability of the most dominant order Caudovirales and the families Siphoviridae, Podoviridae, and Inoviridae, and the dominant family Microviridae. Further studies are needed to confirm these findings. © The Author(s) 2024.","T. Hansen; The Novo Nordisk Foundation Center for Basic Metabolic Research, Faculty of Health and Medical Sciences, University of Copenhagen, Copenhagen, Denmark; email: torben.hansen@sund.ku.dk; M.K. Andersen; The Novo Nordisk Foundation Center for Basic Metabolic Research, Faculty of Health and Medical Sciences, University of Copenhagen, Copenhagen, Denmark; email: metteandersen@sund.ku.dk","","Nature Research","20452322","","","","English","Sci. Rep.","Article","Final","All Open Access; Gold Open Access","Scopus","2-s2.0-85189966361"
