"Authors","Author full names","Author(s) ID","Title","Year","Source title","Volume","Issue","Art. No.","Page start","Page end","Page count","Cited by","DOI","Link","Affiliations","Authors with affiliations","Abstract","Correspondence Address","Editors","Publisher","ISSN","ISBN","CODEN","PubMed ID","Language of Original Document","Abbreviated Source Title","Document Type","Publication Stage","Open Access","Source","EID"
"Ribeiro A.F.; Fitas A.L.; Pires M.O.; Matoso P.; Ligeiro D.; Sobral D.; Penha-Gonçalves C.; Demengeot J.; Caramalho I.; Limbert C.","Ribeiro, Andreia Fiúza (59291029200); Fitas, Ana Laura (56146115900); Pires, Marcela Oliveira (59354107000); Matoso, Paula (37021655000); Ligeiro, Dário (14633861700); Sobral, Daniel (22433944500); Penha-Gonçalves, Carlos (6602527631); Demengeot, Jocelyne (6603702602); Caramalho, Íris (6507416937); Limbert, Catarina (6603473629)","59291029200; 56146115900; 59354107000; 37021655000; 14633861700; 22433944500; 6602527631; 6603702602; 6507416937; 6603473629","Whole Exome Sequencing in Children with Type 1 Diabetes before Age 6 Years Reveals Insights into Disease Heterogeneity","2024","Journal of Diabetes Research","2024","","3076895","","","","0","10.1155/2024/3076895","https://www.scopus.com/inward/record.uri?eid=2-s2.0-85205605241&doi=10.1155%2f2024%2f3076895&partnerID=40&md5=cbe3cde881121edc303e816e4d3d03e5","Pediatric Endocrinology Unit, Hospital de Dona Estefania, São Jose Local Health Unit, Lisbon, Portugal; Pediatric Department, Hospital Prof. Doutor Fernando Fonseca, Amadora Sintra Local Health Unit, Amadora, Portugal; Comprehensive Health Research Centre (CHRC), NOVA Medical School, Universidade NOVA de Lisboa, Lisbon, Portugal; Pediatric Department, Hospital de São Francisco Xavier, Lisboa Ocidental Local Health Unit, Lisbon, Portugal; Instituto Gulbenkian de Ciência, Oeiras, Portugal; Blood and Transplantation Center of Lisbon, Instituto Português Do Sangue e da Transplantação, Lisbon, Portugal; Immunosurgery Unit Champalimaud Foundation, Lisbon, Portugal; Faculty of Sciences University of Lisbon, Lisbon, Portugal","Ribeiro A.F., Pediatric Endocrinology Unit, Hospital de Dona Estefania, São Jose Local Health Unit, Lisbon, Portugal, Pediatric Department, Hospital Prof. Doutor Fernando Fonseca, Amadora Sintra Local Health Unit, Amadora, Portugal; Fitas A.L., Pediatric Endocrinology Unit, Hospital de Dona Estefania, São Jose Local Health Unit, Lisbon, Portugal, Comprehensive Health Research Centre (CHRC), NOVA Medical School, Universidade NOVA de Lisboa, Lisbon, Portugal; Pires M.O., Pediatric Endocrinology Unit, Hospital de Dona Estefania, São Jose Local Health Unit, Lisbon, Portugal, Pediatric Department, Hospital de São Francisco Xavier, Lisboa Ocidental Local Health Unit, Lisbon, Portugal; Matoso P., Instituto Gulbenkian de Ciência, Oeiras, Portugal; Ligeiro D., Blood and Transplantation Center of Lisbon, Instituto Português Do Sangue e da Transplantação, Lisbon, Portugal, Immunosurgery Unit Champalimaud Foundation, Lisbon, Portugal; Sobral D., Instituto Gulbenkian de Ciência, Oeiras, Portugal; Penha-Gonçalves C., Instituto Gulbenkian de Ciência, Oeiras, Portugal; Demengeot J., Instituto Gulbenkian de Ciência, Oeiras, Portugal; Caramalho I., Instituto Gulbenkian de Ciência, Oeiras, Portugal, Faculty of Sciences University of Lisbon, Lisbon, Portugal; Limbert C., Pediatric Endocrinology Unit, Hospital de Dona Estefania, São Jose Local Health Unit, Lisbon, Portugal, Comprehensive Health Research Centre (CHRC), NOVA Medical School, Universidade NOVA de Lisboa, Lisbon, Portugal","Aims: This study is aimed at comparing whole exome sequencing (WES) data with the clinical presentation in children with type 1 diabetes onset ≤ 5 years of age (EOT1D).Methods: WES was performed in 99 unrelated children with EOT1D with subsequent analysis to identify potentially deleterious rare variants in MODY genes. High-resolution HLA class II haplotyping, SNP genotyping, and T1D-genetic risk score (T1D-GRS) were also evaluated.Results: Eight of the ninety-nine EOT1D participants carried a potentially deleterious rare variant in a MODY gene. Rare variants affected five genes: GCK (n=1), HNF1B (n=2), HNF4A (n=1), PDX1 (n=2), and RFX6 (n=2). At diagnosis, these children had a mean age of 3.0 years, a mean HbA1c of 10.5%, a detectable C-peptide in 5/8, and a positive islet autoantibody in 6/7. Children with MODY variants tend to exhibit a lower number of pancreatic autoantibodies and a lower fasting C-peptide compared to EOT1D without MODY rare variants. They also carried at least one high-risk DR3-DQ2 or DR4-DQ8 haplotype and exhibited a T1D-GRS similar to the other individuals in the EOT1D cohort, but higher than healthy controls.Conclusions: WES found potentially deleterious rare variants in MODY genes in 8.1% of EOT1D, occurring in the context of a T1D genetic background. Such genetic variants may contribute to disease precipitation by a β-cell dysfunction mechanism. This supports the concept of different endotypes of T1D, and WES at T1D onset may be a prerequisite for the implementation of precision therapies in children with autoimmune diabetes. © 2024 Andreia Fiúza Ribeiro et al.","C. Limbert; Pediatric Endocrinology Unit, Hospital de Dona Estefania, São Jose Local Health Unit, Lisbon, Portugal; email: climbert@gmail.com; I. Caramalho; Instituto Gulbenkian de Ciência, Oeiras, Portugal; email: icaramalho@igc.gulbenkian.pt","","Hindawi Limited","23146745","","","39364395","English","J. Dia. Res","Article","Final","All Open Access; Gold Open Access","Scopus","2-s2.0-85205605241"
"Thomas N.J.; Dennis J.M.; Sharp S.A.; Kaur A.; Misra S.; Walkey H.C.; Johnston D.G.; Oliver N.S.; Hagopian W.A.; Weedon M.N.; Patel K.A.; Oram R.A.","Thomas, Nicholas J. (55376980700); Dennis, John M. (7202979963); Sharp, Seth A. (57201468304); Kaur, Akaal (57190424604); Misra, Shivani (36993263000); Walkey, Helen C. (8451864800); Johnston, Desmond G. (57192116794); Oliver, Nick S. (8414954000); Hagopian, William A. (57189586532); Weedon, Michael N. (6603919352); Patel, Kashup A. (57188657944); Oram, Richard A. (57214847554)","55376980700; 7202979963; 57201468304; 57190424604; 36993263000; 8451864800; 57192116794; 8414954000; 57189586532; 6603919352; 57188657944; 57214847554","DR15-DQ6 remains dominantly protective against type 1 diabetes throughout the first five decades of life","2021","Diabetologia","64","10","","2258","2265","7","10","10.1007/s00125-021-05513-4","https://www.scopus.com/inward/record.uri?eid=2-s2.0-85111887881&doi=10.1007%2fs00125-021-05513-4&partnerID=40&md5=2548e6899fc9378397b0073ea485c229","Institute of Biomedical and Clinical Science, University of Exeter Medical School, Exeter, United Kingdom; Department of Diabetes and Endocrinology, Royal Devon and Exeter NHS Foundation Trust, Exeter, United Kingdom; Faculty of Medicine, Imperial College, London, United Kingdom; Pacific Northwest Research Institute, Seattle, WA, United States; Renal Department, Royal Devon and Exeter NHS Foundation Trust, Exeter, United Kingdom","Thomas N.J., Institute of Biomedical and Clinical Science, University of Exeter Medical School, Exeter, United Kingdom, Department of Diabetes and Endocrinology, Royal Devon and Exeter NHS Foundation Trust, Exeter, United Kingdom; Dennis J.M., Institute of Biomedical and Clinical Science, University of Exeter Medical School, Exeter, United Kingdom; Sharp S.A., Institute of Biomedical and Clinical Science, University of Exeter Medical School, Exeter, United Kingdom; Kaur A., Faculty of Medicine, Imperial College, London, United Kingdom; Misra S., Faculty of Medicine, Imperial College, London, United Kingdom; Walkey H.C., Faculty of Medicine, Imperial College, London, United Kingdom; Johnston D.G., Faculty of Medicine, Imperial College, London, United Kingdom; Oliver N.S., Faculty of Medicine, Imperial College, London, United Kingdom; Hagopian W.A., Pacific Northwest Research Institute, Seattle, WA, United States; Weedon M.N., Institute of Biomedical and Clinical Science, University of Exeter Medical School, Exeter, United Kingdom; Patel K.A., Institute of Biomedical and Clinical Science, University of Exeter Medical School, Exeter, United Kingdom, Department of Diabetes and Endocrinology, Royal Devon and Exeter NHS Foundation Trust, Exeter, United Kingdom; Oram R.A., Institute of Biomedical and Clinical Science, University of Exeter Medical School, Exeter, United Kingdom, Renal Department, Royal Devon and Exeter NHS Foundation Trust, Exeter, United Kingdom","Aims/hypothesis: Among white European children developing type 1 diabetes, the otherwise common HLA haplotype DR15-DQ6 is rare, and highly protective. Adult-onset type 1 diabetes is now known to represent more overall cases than childhood onset, but it is not known whether DR15-DQ6 is protective in older-adult-onset type 1 diabetes. We sought to quantify DR15-DQ6 protection against type 1 diabetes as age of onset increased. Methods: In two independent cohorts we assessed the proportion of type 1 diabetes cases presenting through the first 50 years of life with DR15-DQ6, compared with population controls. In the After Diabetes Diagnosis Research Support System-2 (ADDRESS-2) cohort (n = 1458) clinician-diagnosed type 1 diabetes was confirmed by positivity for one or more islet-specific autoantibodies. In UK Biobank (n = 2502), we estimated type 1 diabetes incidence rates relative to baseline HLA risk for each HLA group using Poisson regression. Analyses were restricted to white Europeans and were performed in three groups according to age at type 1 diabetes onset: 0–18 years, 19–30 years and 31–50 years. Results: DR15-DQ6 was protective against type 1 diabetes through to age 50 years (OR < 1 for each age group, all p < 0.001). The following ORs for type 1 diabetes, relative to a neutral HLA genotype, were observed in ADDRESS-2: age 5–18 years OR 0.16 (95% CI 0.08, 0.31); age 19–30 years OR 0.10 (0.04, 0.23); and age 31–50 years OR 0.37 (0.21, 0.68). DR15-DQ6 also remained highly protective at all ages in UK Biobank. Without DR15-DQ6, the presence of major type 1 diabetes high-risk haplotype (either DR3-DQ2 or DR4-DQ8) was associated with increased risk of type 1 diabetes. Conclusions/interpretation: HLA DR15-DQ6 confers dominant protection from type 1 diabetes across the first five decades of life. Graphical abstract: [Figure not available: see fulltext.] © 2021, The Author(s).","N.J. Thomas; Institute of Biomedical and Clinical Science, University of Exeter Medical School, Exeter, United Kingdom; email: n.thomas3@exeter.ac.uk; R.A. Oram; Institute of Biomedical and Clinical Science, University of Exeter Medical School, Exeter, United Kingdom; email: r.oram@exeter.ac.uk","","Springer Science and Business Media Deutschland GmbH","0012186X","","DBTGA","34272580","English","Diabetologia","Article","Final","All Open Access; Hybrid Gold Open Access","Scopus","2-s2.0-85111887881"
"Seidel-Jacobs E.; Ptushkina V.; Strassburger K.; Icks A.; Kuss O.; Burkart V.; Szendroedi J.; Müssig K.; Bódis K.; Karusheva Y.; Zaharia O.-P.; Roden M.; Rathmann W.; Al-Hasani H.; Burkart V.; Buyken A.E.; Geerling G.; Herder C.; Icks A.; Jandeleit-Dahm K.; Kahl S.; Kotzka J.; Lammert E.; Trenkamp S.; Rathmann W.; Schrauwen-Hinderling V.; Ziegler D.","Seidel-Jacobs, Esther (57221605363); Ptushkina, Violetta (57204881688); Strassburger, Klaus (57196114977); Icks, Andrea (6603932567); Kuss, Oliver (57188815079); Burkart, Volker (7003802200); Szendroedi, Julia (6507093621); Müssig, Karsten (8923633600); Bódis, Kálmán (57189626601); Karusheva, Yanislava (57200619908); Zaharia, Oana-Patricia (57200613709); Roden, Michael (56289245900); Rathmann, Wolfgang (57222582003); Al-Hasani, H. (57203030438); Burkart, V. (57562090500); Buyken, A.E. (57190079189); Geerling, G. (56208183000); Herder, C. (57222583713); Icks, A. (59268494100); Jandeleit-Dahm, K. (6602725433); Kahl, S. (55559876800); Kotzka, J. (57214771787); Lammert, E. (6603562250); Trenkamp, S. (57561885000); Rathmann, W. (55800240200); Schrauwen-Hinderling, V. (6603375308); Ziegler, D. (7202565148)","57221605363; 57204881688; 57196114977; 6603932567; 57188815079; 7003802200; 6507093621; 8923633600; 57189626601; 57200619908; 57200613709; 56289245900; 57222582003; 57203030438; 57562090500; 57190079189; 56208183000; 57222583713; 59268494100; 6602725433; 55559876800; 57214771787; 6603562250; 57561885000; 55800240200; 6603375308; 7202565148","Socio-economic inequalities in glycaemic control in recently diagnosed adults with type 1 and type 2 diabetes","2022","Diabetic Medicine","39","7","e14833","","","","4","10.1111/dme.14833","https://www.scopus.com/inward/record.uri?eid=2-s2.0-85127561389&doi=10.1111%2fdme.14833&partnerID=40&md5=34d00130fb5da2f1377c7fe4016e08e8","Institute for Biometrics and Epidemiology, German Diabetes Center (DDZ), Leibniz Center for Diabetes Research at Heinrich Heine University Düsseldorf, Düsseldorf, Germany; German Center for Diabetes Research (DZD), Partner Düsseldorf, München-Neuherberg, Germany; Institute for Health Service Research and Health Economics, German Diabetes Center (DDZ), Leibniz Center for Diabetes Research at Heinrich Heine University Düsseldorf, Düsseldorf, Germany; Institute for Health Service Research and Health Economics, Medical Faculty, Heinrich Heine University Düsseldorf, Düsseldorf, Germany; Centre for Health and Society, Medical Faculty and University Hospital Düsseldorf, Heinrich Heine University Düsseldorf, Düsseldorf, Germany; Institute for Clinical Diabetology, German Diabetes Center (DDZ), Leibniz Center for Diabetes Research at Heinrich Heine University Düsseldorf, Düsseldorf, Germany; Department of Internal Medicine I and Clinical Chemistry, Heidelberg University Hospital, Heidelberg, Germany; Department of Internal Medicine and Gastroenterology, Niels Stensen Hospitals, Franziskus Hospital Harderberg, Georgsmarienhütte, Germany; Department of Endocrinology and Diabetology, Medical Faculty and University Hospital, Heinrich Heine University Düsseldorf, Düsseldorf, Germany; University of Cambridge, Wellcome-MRC Institute of Metabolic Science, Cambridge, United Kingdom; Medical Faculty, Heinrich Heine University, Düsseldorf, Germany","Seidel-Jacobs E., Institute for Biometrics and Epidemiology, German Diabetes Center (DDZ), Leibniz Center for Diabetes Research at Heinrich Heine University Düsseldorf, Düsseldorf, Germany, German Center for Diabetes Research (DZD), Partner Düsseldorf, München-Neuherberg, Germany; Ptushkina V., Institute for Biometrics and Epidemiology, German Diabetes Center (DDZ), Leibniz Center for Diabetes Research at Heinrich Heine University Düsseldorf, Düsseldorf, Germany, German Center for Diabetes Research (DZD), Partner Düsseldorf, München-Neuherberg, Germany; Strassburger K., Institute for Biometrics and Epidemiology, German Diabetes Center (DDZ), Leibniz Center for Diabetes Research at Heinrich Heine University Düsseldorf, Düsseldorf, Germany, German Center for Diabetes Research (DZD), Partner Düsseldorf, München-Neuherberg, Germany; Icks A., German Center for Diabetes Research (DZD), Partner Düsseldorf, München-Neuherberg, Germany, Institute for Health Service Research and Health Economics, German Diabetes Center (DDZ), Leibniz Center for Diabetes Research at Heinrich Heine University Düsseldorf, Düsseldorf, Germany, Institute for Health Service Research and Health Economics, Medical Faculty, Heinrich Heine University Düsseldorf, Düsseldorf, Germany, Centre for Health and Society, Medical Faculty and University Hospital Düsseldorf, Heinrich Heine University Düsseldorf, Düsseldorf, Germany; Kuss O., Institute for Biometrics and Epidemiology, German Diabetes Center (DDZ), Leibniz Center for Diabetes Research at Heinrich Heine University Düsseldorf, Düsseldorf, Germany, German Center for Diabetes Research (DZD), Partner Düsseldorf, München-Neuherberg, Germany, Centre for Health and Society, Medical Faculty and University Hospital Düsseldorf, Heinrich Heine University Düsseldorf, Düsseldorf, Germany; Burkart V., German Center for Diabetes Research (DZD), Partner Düsseldorf, München-Neuherberg, Germany, Institute for Clinical Diabetology, German Diabetes Center (DDZ), Leibniz Center for Diabetes Research at Heinrich Heine University Düsseldorf, Düsseldorf, Germany; Szendroedi J., German Center for Diabetes Research (DZD), Partner Düsseldorf, München-Neuherberg, Germany, Department of Internal Medicine I and Clinical Chemistry, Heidelberg University Hospital, Heidelberg, Germany; Müssig K., German Center for Diabetes Research (DZD), Partner Düsseldorf, München-Neuherberg, Germany, Institute for Clinical Diabetology, German Diabetes Center (DDZ), Leibniz Center for Diabetes Research at Heinrich Heine University Düsseldorf, Düsseldorf, Germany, Department of Internal Medicine and Gastroenterology, Niels Stensen Hospitals, Franziskus Hospital Harderberg, Georgsmarienhütte, Germany, Department of Endocrinology and Diabetology, Medical Faculty and University Hospital, Heinrich Heine University Düsseldorf, Düsseldorf, Germany; Bódis K., German Center for Diabetes Research (DZD), Partner Düsseldorf, München-Neuherberg, Germany, Institute for Clinical Diabetology, German Diabetes Center (DDZ), Leibniz Center for Diabetes Research at Heinrich Heine University Düsseldorf, Düsseldorf, Germany, Department of Endocrinology and Diabetology, Medical Faculty and University Hospital, Heinrich Heine University Düsseldorf, Düsseldorf, Germany; Karusheva Y., German Center for Diabetes Research (DZD), Partner Düsseldorf, München-Neuherberg, Germany, Institute for Clinical Diabetology, German Diabetes Center (DDZ), Leibniz Center for Diabetes Research at Heinrich Heine University Düsseldorf, Düsseldorf, Germany, University of Cambridge, Wellcome-MRC Institute of Metabolic Science, Cambridge, United Kingdom; Zaharia O.-P., German Center for Diabetes Research (DZD), Partner Düsseldorf, München-Neuherberg, Germany, Institute for Clinical Diabetology, German Diabetes Center (DDZ), Leibniz Center for Diabetes Research at Heinrich Heine University Düsseldorf, Düsseldorf, Germany, Department of Endocrinology and Diabetology, Medical Faculty and University Hospital, Heinrich Heine University Düsseldorf, Düsseldorf, Germany; Roden M., German Center for Diabetes Research (DZD), Partner Düsseldorf, München-Neuherberg, Germany, Institute for Clinical Diabetology, German Diabetes Center (DDZ), Leibniz Center for Diabetes Research at Heinrich Heine University Düsseldorf, Düsseldorf, Germany, Department of Endocrinology and Diabetology, Medical Faculty and University Hospital, Heinrich Heine University Düsseldorf, Düsseldorf, Germany; Rathmann W., Institute for Biometrics and Epidemiology, German Diabetes Center (DDZ), Leibniz Center for Diabetes Research at Heinrich Heine University Düsseldorf, Düsseldorf, Germany, German Center for Diabetes Research (DZD), Partner Düsseldorf, München-Neuherberg, Germany, Medical Faculty, Heinrich Heine University, Düsseldorf, Germany; Al-Hasani H.; Burkart V.; Buyken A.E.; Geerling G.; Herder C.; Icks A.; Jandeleit-Dahm K.; Kahl S.; Kotzka J.; Lammert E.; Trenkamp S.; Rathmann W.; Schrauwen-Hinderling V.; Ziegler D.","Background and aims: It is unclear whether socio-economic status (SES) is associated with glycaemic control in people with recently diagnosed diabetes. The aim was to investigate whether SES is related to haemoglobin A1c (HbA1c) during the first year after diagnosis in people with type 1 and type 2 diabetes and if metabolic, quality of care or mental factors may explain the association. Methods: In the German Diabetes Study, people with type 1 (n = 274, median age 36 [25th; 75th percentile: 28; 48] years) and type 2 diabetes (n = 424, 54 [47; 60] years) underwent detailed metabolic characterisation within the first year after diagnosis. SES was documented using a standardised questionnaire. Associations between SES and HbA1c were assessed using multivariable linear regression and restricted cubic spline regression analyses. Additional covariables were patient characteristics, laboratory measurements, health behaviour, quality of care and depression variables. Models were separately fitted for diabetes type, SES and its dimensions (income, education, occupation). Results: Higher SES score was associated with lower HbA1c (−0.7 mmol/mol per unit increase in SES, 95% CI: −1.1; −0.2 mmol/mol [−0.1%, 95% CI: −0.1; 0.0%]) in people with type 1 diabetes. Included covariates did not attenuate this association. In people with type 2 diabetes, effect estimates were close to zero indicating no relevant difference. Conclusion: Socio-economic inequalities in HbA1c already exist during the first year after diagnosis in people with type 1 diabetes. The absence of association between glycaemic control and SES in type 2 diabetes could be due to the lower complexity of diabetes therapy compared to type 1 diabetes. © 2022 The Authors. Diabetic Medicine published by John Wiley & Sons Ltd on behalf of Diabetes UK.","E. Seidel-Jacobs; Institute for Biometrics and Epidemiology, German Diabetes Center (DDZ), Leibniz Center for Diabetes Research at Heinrich Heine University Düsseldorf, Düsseldorf, Germany; email: esther.seidel-jacobs@ddz.de","","John Wiley and Sons Inc","07423071","","DIMEE","35324027","English","Diabet. Med.","Article","Final","All Open Access; Green Open Access","Scopus","2-s2.0-85127561389"
"Miller R.G.; McGurnaghan S.J.; Onengut-Gumuscu S.; Chen W.-M.; Colhoun H.M.; Rich S.S.; Orchard T.J.; Costacou T.","Miller, Rachel G. (15755602700); McGurnaghan, Stuart J. (57194377826); Onengut-Gumuscu, Suna (57207901853); Chen, Wei-Min (55716075100); Colhoun, Helen M. (7003466904); Rich, Stephen S. (57216593979); Orchard, Trevor J. (56265414900); Costacou, Tina (6602286790)","15755602700; 57194377826; 57207901853; 55716075100; 7003466904; 57216593979; 56265414900; 6602286790","Insulin resistance-associated genetic variants in type 1 diabetes","2021","Journal of Diabetes and its Complications","35","4","107842","","","","8","10.1016/j.jdiacomp.2020.107842","https://www.scopus.com/inward/record.uri?eid=2-s2.0-85099546231&doi=10.1016%2fj.jdiacomp.2020.107842&partnerID=40&md5=eaa4998d959dcfe3a2136fd8bb1c5640","Department of Epidemiology, Graduate School of Public Health, University of Pittsburgh, 4200 Fifth Avenue, Pittsburgh, 15260, PA, United States; Usher Institute of Population Health Sciences and Informatics, University of Edinburgh, Edinburgh, EH16 4UX, Scotland, Ireland; Center for Public Health Genomics, University of Virginia, 200 Jeanette Lancaster Way, Charlottesville, 22903, VA, United States","Miller R.G., Department of Epidemiology, Graduate School of Public Health, University of Pittsburgh, 4200 Fifth Avenue, Pittsburgh, 15260, PA, United States; McGurnaghan S.J., Usher Institute of Population Health Sciences and Informatics, University of Edinburgh, Edinburgh, EH16 4UX, Scotland, Ireland; Onengut-Gumuscu S., Center for Public Health Genomics, University of Virginia, 200 Jeanette Lancaster Way, Charlottesville, 22903, VA, United States; Chen W.-M., Center for Public Health Genomics, University of Virginia, 200 Jeanette Lancaster Way, Charlottesville, 22903, VA, United States; Colhoun H.M., Usher Institute of Population Health Sciences and Informatics, University of Edinburgh, Edinburgh, EH16 4UX, Scotland, Ireland; Rich S.S., Center for Public Health Genomics, University of Virginia, 200 Jeanette Lancaster Way, Charlottesville, 22903, VA, United States; Orchard T.J., Department of Epidemiology, Graduate School of Public Health, University of Pittsburgh, 4200 Fifth Avenue, Pittsburgh, 15260, PA, United States; Costacou T., Department of Epidemiology, Graduate School of Public Health, University of Pittsburgh, 4200 Fifth Avenue, Pittsburgh, 15260, PA, United States","Aims: To examine candidate insulin resistance single nucleotide polymorphisms (SNPs) for associations with glycemic control, insulin resistance, BMI, and complications in an observational type 1 diabetes (T1D) cohort: the Pittsburgh Epidemiology of Diabetes Complications (EDC) study. Methods: In 422 European-ancestry participants, we assessed associations using additive models between 15 candidate SNPs and 25-year mortality, cardiovascular disease, microalbuminuria, overt nephropathy and proliferative retinopathy, and 25-year mean HbA1c, estimated glucose disposal rate (eGDR, inverse measure of insulin resistance), and BMI. Results: The A allele of rs12970134 was associated with higher mean HbA1c (β = +0.34 ± 0.09, p = 0.00009) and nominally associated with worse eGDR (p = 0.02). Further analyses suggest the HbA1c association may be modified by diabetes therapy regimen: rs12970134 AA genotype was associated with higher HbA1c under non-intensive therapy conditions (<3 insulin injections/day or monitoring blood glucose<3 times/day [p = 0.004]), but not under intensive therapy (≥3 injections/day or insulin pump and monitoring glucose≥3 times/day [p = 0.71]). There were no significant associations between any SNPs and BMI or complications. Conclusions: rs12970134, near MC4R, is strongly associated with HbA1c in this cohort. Further exploration of this genomic region is warranted, as it may hold promise for discovering new therapeutic targets to improve glycemic control in T1D. © 2020 Elsevier Inc.","R.G. Miller; University of Pittsburgh, Pittsburgh, 3512 Fifth Avenue, 15213, United States; email: MillerR@edc.pitt.edu","","Elsevier Inc.","10568727","","JDICE","33468396","English","J. Diabetes Complications","Article","Final","All Open Access; Green Open Access","Scopus","2-s2.0-85099546231"
