"Peng Y.; Li X.; Xiang Y.; Yan X.; Zhou H.; Tang X.; Cheng J.; Niu X.; Liu J.; Ji Q.; Ji L.; Huang G.; Zhou Z.","Peng, Yiman (57575344900); Li, Xia (55917968300); Xiang, Yufei (53664848800); Yan, Xiang (8724264500); Zhou, Houde (7404743204); Tang, Xiaohan (57211280524); Cheng, Jin (57189657656); Niu, Xiaohong (55768171100); Liu, Jing (57201631727); Ji, Qiuhe (15822229300); Ji, Linong (57225730408); Huang, Gan (7403425062); Zhou, Zhiguang (8417885800)","57575344900; 55917968300; 53664848800; 8724264500; 7404743204; 57211280524; 57189657656; 55768171100; 57201631727; 15822229300; 57225730408; 7403425062; 8417885800","GAD65 Antibody Epitopes and Genetic Background in Latent Autoimmune Diabetes in Youth (LADY)","2022","Frontiers in Immunology","13","","836952","","","","5","10.3389/fimmu.2022.836952","https://www.scopus.com/inward/record.uri?eid=2-s2.0-85128177917&doi=10.3389%2ffimmu.2022.836952&partnerID=40&md5=3b7f5357a9d8cf598b3020050622054a","National Clinical Research Center for Metabolic Diseases, Key Laboratory of Diabetes Immunology (Central South University), Ministry of Education, Department of Metabolism and Endocrinology, The Second Xiangya Hospital of Central South University, Changsha, China; Department of Endocrinology, Heji Hospital, Changzhi Medical College, Changzhi, China; Department of Endocrinology, Gansu Provincial Hospital, Lanzhou, China; Department of Endocrinology, Xijing Hospital, Fourth Military Medical University, Xi, China; Department of Endocrinology and Metabolism, Peking University People’s Hospital, Beijing, China","Peng Y., National Clinical Research Center for Metabolic Diseases, Key Laboratory of Diabetes Immunology (Central South University), Ministry of Education, Department of Metabolism and Endocrinology, The Second Xiangya Hospital of Central South University, Changsha, China; Li X., National Clinical Research Center for Metabolic Diseases, Key Laboratory of Diabetes Immunology (Central South University), Ministry of Education, Department of Metabolism and Endocrinology, The Second Xiangya Hospital of Central South University, Changsha, China; Xiang Y., National Clinical Research Center for Metabolic Diseases, Key Laboratory of Diabetes Immunology (Central South University), Ministry of Education, Department of Metabolism and Endocrinology, The Second Xiangya Hospital of Central South University, Changsha, China; Yan X., National Clinical Research Center for Metabolic Diseases, Key Laboratory of Diabetes Immunology (Central South University), Ministry of Education, Department of Metabolism and Endocrinology, The Second Xiangya Hospital of Central South University, Changsha, China; Zhou H., National Clinical Research Center for Metabolic Diseases, Key Laboratory of Diabetes Immunology (Central South University), Ministry of Education, Department of Metabolism and Endocrinology, The Second Xiangya Hospital of Central South University, Changsha, China; Tang X., National Clinical Research Center for Metabolic Diseases, Key Laboratory of Diabetes Immunology (Central South University), Ministry of Education, Department of Metabolism and Endocrinology, The Second Xiangya Hospital of Central South University, Changsha, China; Cheng J., National Clinical Research Center for Metabolic Diseases, Key Laboratory of Diabetes Immunology (Central South University), Ministry of Education, Department of Metabolism and Endocrinology, The Second Xiangya Hospital of Central South University, Changsha, China; Niu X., Department of Endocrinology, Heji Hospital, Changzhi Medical College, Changzhi, China; Liu J., Department of Endocrinology, Gansu Provincial Hospital, Lanzhou, China; Ji Q., Department of Endocrinology, Xijing Hospital, Fourth Military Medical University, Xi, China; Ji L., Department of Endocrinology and Metabolism, Peking University People’s Hospital, Beijing, China; Huang G., National Clinical Research Center for Metabolic Diseases, Key Laboratory of Diabetes Immunology (Central South University), Ministry of Education, Department of Metabolism and Endocrinology, The Second Xiangya Hospital of Central South University, Changsha, China; Zhou Z., National Clinical Research Center for Metabolic Diseases, Key Laboratory of Diabetes Immunology (Central South University), Ministry of Education, Department of Metabolism and Endocrinology, The Second Xiangya Hospital of Central South University, Changsha, China","Epitope-specific GAD65Abs and HLA-DR-DQ gene assays help improve the value of risk stratification in autoimmune diabetes mellitus and protect islet function. Identification and early intervention are important for latent autoimmune diabetes in youth (LADY). The aims of this study were to investigate 1) the frequencies of the epitope-specific GAD65Abs and HLA-DR-DQ genes in LADY and 2) the association between HLA-DR-DQ genes and epitope-specific GAD65Abs. Higher frequencies of GAD65-CAb and multiepitope GAD65Abs were observed in young type 1 diabetes, LADY, and old type 1 diabetes subjects than those in latent autoimmune diabetes in adult (LADA) patients. The frequencies of the specific susceptible HLA haplotype DR3, total susceptible HLA haplotypes, and high-risk genotypes were higher in type 1 diabetes and LADY patients than those in LADA patients. In contrast, type 1 diabetes and LADY patients had lower frequencies of low/no genetic risk genotypes (DRX/X) than those of LADA patients. Logistic regression analysis suggested that the susceptible HLA haplotypes were risk factors for glutamic acid decarboxylase antibody (GADA) multiepitope positivity in autoimmune diabetes mellitus. LADY may be more severe than LADA, and LADY seemed to be a transitional type of type 1 diabetes and LADA. GADA epitope and HLA-DR-DQ gene assays are important for risk stratification in autoimmune diabetes mellitus and protection of islet function. Copyright © 2022 Peng, Li, Xiang, Yan, Zhou, Tang, Cheng, Niu, Liu, Ji, Ji, Huang and Zhou.","G. Huang; National Clinical Research Center for Metabolic Diseases, Key Laboratory of Diabetes Immunology (Central South University), Ministry of Education, Department of Metabolism and Endocrinology, The Second Xiangya Hospital of Central South University, Changsha, China; email: huanggan007@csu.edu.cn","","Frontiers Media S.A.","16643224","","","35392100","English","Front. Immunol.","Article","Final","All Open Access; Gold Open Access","Scopus","2-s2.0-85128177917"
"He L.-P.; Song Y.-X.; Zhu T.; Gu W.; Liu C.-W.","He, Lian-Ping (55630599500); Song, Yu-Xin (57883977400); Zhu, Ting (58079239000); Gu, Wei (57208556151); Liu, Chang-Wei (56890031200)","55630599500; 57883977400; 58079239000; 57208556151; 56890031200","Progress in the Relationship between Vitamin D Deficiency and the Incidence of Type 1 Diabetes Mellitus in Children","2022","Journal of Diabetes Research","2022","","5953562","","","","20","10.1155/2022/5953562","https://www.scopus.com/inward/record.uri?eid=2-s2.0-85137705664&doi=10.1155%2f2022%2f5953562&partnerID=40&md5=a78ad536f0e33f6fe5fec93bbc32f87c","School of Medicine, Taizhou University, Zhejiang, Jiaojiang, 318000, China; Children's Hospital of Nanjing Medical University, Jiangsu, Nanjing, 210008, China","He L.-P., School of Medicine, Taizhou University, Zhejiang, Jiaojiang, 318000, China; Song Y.-X., School of Medicine, Taizhou University, Zhejiang, Jiaojiang, 318000, China; Zhu T., Children's Hospital of Nanjing Medical University, Jiangsu, Nanjing, 210008, China; Gu W., Children's Hospital of Nanjing Medical University, Jiangsu, Nanjing, 210008, China; Liu C.-W., Children's Hospital of Nanjing Medical University, Jiangsu, Nanjing, 210008, China","Type 1 diabetes mellitus (T1DM) is an autoimmune disease, due to a large number of islet β cells damaged, resulting in an absolute lack of insulin, ultimately relying on insulin therapy. Vitamin D is a fat-soluble sterol derivative that not only participates in calcium and phosphorus metabolism but also acts as an immunomodulatory role by binding to nuclear vitamin D receptors to regulate the expression of transcription factors. Increasing evidence has shown that vitamin D has immunoregulation and anti-inflammatory effects, and it may play a role in T cell regulatory responses due to downregulation in the expression of cathepsin G and inhibition of CD4+ T cell activation and protection of β cells from immune attack and is beneficial in decreasing oxidative stress in T1DM patients. Epidemiologic evidence demonstrates involvement of vitamin D deficiency in T1DM pathogenesis, with the immune system improperly targeting and destroying its own islet β cells. In addition, polymorphisms in genes critical for vitamin D metabolism may increase the risk of islet autoimmunity and T1DM. In this paper, the relationship between vitamin D deficiency and the molecular mechanism of T1DM was discussed.  © 2022 Lian-Ping He et al.","C.-W. Liu; Children's Hospital of Nanjing Medical University, Nanjing, Jiangsu, 210008, China; email: liuchangwei07@163.com","","Hindawi Limited","23146745","","","36090587","English","J. Dia. Res","Review","Final","All Open Access; Gold Open Access","Scopus","2-s2.0-85137705664"
"Harsunen M.; Kettunen J.L.T.; Härkönen T.; Dwivedi O.; Lehtovirta M.; Vähäsalo P.; Veijola R.; Ilonen J.; Miettinen P.J.; Knip M.; Tuomi T.","Harsunen, Minna (54408479700); Kettunen, Jarno L. T. (57194494582); Härkönen, Taina (6603713513); Dwivedi, Om (57201451874); Lehtovirta, Mikko (7003979820); Vähäsalo, Paula (6603663095); Veijola, Riitta (6603765826); Ilonen, Jorma (7103356970); Miettinen, Päivi J. (7004935171); Knip, Mikael (57204443608); Tuomi, Tiinamaija (57216598639)","54408479700; 57194494582; 6603713513; 57201451874; 7003979820; 6603663095; 6603765826; 7103356970; 7004935171; 57204443608; 57216598639","Identification of monogenic variants in more than ten per cent of children without type 1 diabetes-related autoantibodies at diagnosis in the Finnish Pediatric Diabetes Register","2023","Diabetologia","66","3","","438","449","11","11","10.1007/s00125-022-05834-y","https://www.scopus.com/inward/record.uri?eid=2-s2.0-85142700996&doi=10.1007%2fs00125-022-05834-y&partnerID=40&md5=2d204771bba9dc569582ae43e554eb30","New Children’s Hospital, Pediatric Research Center, University of Helsinki and Helsinki University Hospital, Helsinki, Finland; Folkhälsan Research Center, Biomedicum Helsinki, Helsinki, Finland; Research Program for Clinical and Molecular Metabolism, University of Helsinki, Helsinki, Finland; Abdominal Centre, Endocrinology, University of Helsinki and Helsinki University Hospital, Helsinki, Finland; Finnish Institute for Molecular Medicine, University of Helsinki, Helsinki, Finland; Department of Pediatrics, PEDEGO Research Unit, University of Oulu, Oulu, Finland; Department of Children and Adolescents, Oulu University Hospital, Oulu, Finland; Medical Research Center, Oulu University Hospital and University of Oulu, Oulu, Finland; Immunogenetics Laboratory, Institute of Biomedicine, University of Turku, Turku, Finland; Translational Stem Cell Biology and Metabolism Research Program, Faculty of Medicine, University of Helsinki, Helsinki, Finland; Tampere Center for Child Health Research, Tampere University Hospital, Tampere, Finland; Lund University Diabetes Centre, Department of Clinical Sciences, Lund University, Lund, Sweden","Harsunen M., New Children’s Hospital, Pediatric Research Center, University of Helsinki and Helsinki University Hospital, Helsinki, Finland, Folkhälsan Research Center, Biomedicum Helsinki, Helsinki, Finland, Research Program for Clinical and Molecular Metabolism, University of Helsinki, Helsinki, Finland; Kettunen J.L.T., Folkhälsan Research Center, Biomedicum Helsinki, Helsinki, Finland, Research Program for Clinical and Molecular Metabolism, University of Helsinki, Helsinki, Finland, Abdominal Centre, Endocrinology, University of Helsinki and Helsinki University Hospital, Helsinki, Finland, Finnish Institute for Molecular Medicine, University of Helsinki, Helsinki, Finland; Härkönen T., Research Program for Clinical and Molecular Metabolism, University of Helsinki, Helsinki, Finland; Dwivedi O., Folkhälsan Research Center, Biomedicum Helsinki, Helsinki, Finland, Finnish Institute for Molecular Medicine, University of Helsinki, Helsinki, Finland; Lehtovirta M., Finnish Institute for Molecular Medicine, University of Helsinki, Helsinki, Finland; Vähäsalo P., Department of Pediatrics, PEDEGO Research Unit, University of Oulu, Oulu, Finland, Department of Children and Adolescents, Oulu University Hospital, Oulu, Finland, Medical Research Center, Oulu University Hospital and University of Oulu, Oulu, Finland; Veijola R., Department of Pediatrics, PEDEGO Research Unit, University of Oulu, Oulu, Finland, Department of Children and Adolescents, Oulu University Hospital, Oulu, Finland, Medical Research Center, Oulu University Hospital and University of Oulu, Oulu, Finland; Ilonen J., Immunogenetics Laboratory, Institute of Biomedicine, University of Turku, Turku, Finland; Miettinen P.J., New Children’s Hospital, Pediatric Research Center, University of Helsinki and Helsinki University Hospital, Helsinki, Finland, Translational Stem Cell Biology and Metabolism Research Program, Faculty of Medicine, University of Helsinki, Helsinki, Finland; Knip M., New Children’s Hospital, Pediatric Research Center, University of Helsinki and Helsinki University Hospital, Helsinki, Finland, Research Program for Clinical and Molecular Metabolism, University of Helsinki, Helsinki, Finland, Tampere Center for Child Health Research, Tampere University Hospital, Tampere, Finland; Tuomi T., Folkhälsan Research Center, Biomedicum Helsinki, Helsinki, Finland, Research Program for Clinical and Molecular Metabolism, University of Helsinki, Helsinki, Finland, Abdominal Centre, Endocrinology, University of Helsinki and Helsinki University Hospital, Helsinki, Finland, Finnish Institute for Molecular Medicine, University of Helsinki, Helsinki, Finland, Lund University Diabetes Centre, Department of Clinical Sciences, Lund University, Lund, Sweden","Aims/hypothesis: Monogenic forms of diabetes (MODY, neonatal diabetes mellitus and syndromic forms) are rare, and affected individuals may be misclassified and treated suboptimally. The prevalence of type 1 diabetes is high in Finnish children but systematic screening for monogenic diabetes has not been conducted. We assessed the prevalence and clinical manifestations of monogenic diabetes in children initially registered with type 1 diabetes in the Finnish Pediatric Diabetes Register (FPDR) but who had no type 1 diabetes-related autoantibodies (AABs) or had only low-titre islet cell autoantibodies (ICAs) at diagnosis. Methods: The FPDR, covering approximately 90% of newly diagnosed diabetic individuals aged ≤15 years in Finland starting from 2002, includes data on diabetes-associated HLA genotypes and AAB data (ICA, and autoantibodies against insulin, GAD, islet antigen 2 and zinc transporter 8) at diagnosis. A next generation sequencing gene panel including 42 genes was used to identify monogenic diabetes. We interpreted the variants in HNF1A by using the gene-specific standardised criteria and reported pathogenic and likely pathogenic findings only. For other genes, we also reported variants of unknown significance if an individual’s phenotype suggested monogenic diabetes. Results: Out of 6482 participants, we sequenced DNA for 152 (2.3%) testing negative for all AABs and 49 (0.8%) positive only for low-titre ICAs (ICAlow). A monogenic form of diabetes was revealed in 19 (12.5%) of the AAB-negative patients (14 [9.2%] had pathogenic or likely pathogenic variants) and two (4.1%) of the ICAlow group. None had ketoacidosis at diagnosis or carried HLA genotypes conferring high risk for type 1 diabetes. The affected genes were GCK, HNF1A, HNF4A, HNF1B, INS, KCNJ11, RFX6, LMNA and WFS1. A switch from insulin to oral medication was successful in four of five patients with variants in HNF1A, HNF4A or KCNJ11. Conclusions/interpretation: More than 10% of AAB-negative children with newly diagnosed diabetes had a genetic finding associated with monogenic diabetes. Because the genetic diagnosis can lead to major changes in treatment, we recommend referring all AAB-negative paediatric patients with diabetes for genetic testing. Low-titre ICAs in the absence of other AABs does not always indicate a diagnosis of type 1 diabetes. Graphical abstract: [Figure not available: see fulltext.]. © 2022, The Author(s).","M. Harsunen; New Children’s Hospital, Pediatric Research Center, University of Helsinki and Helsinki University Hospital, Helsinki, Finland; email: minna.harsunen@hus.fi; J.L.T. Kettunen; Folkhälsan Research Center, Biomedicum Helsinki, Helsinki, Finland; email: jarno.kettunen@helsinki.fi","","Springer Science and Business Media Deutschland GmbH","0012186X","","DBTGA","36418577","English","Diabetologia","Article","Final","All Open Access; Hybrid Gold Open Access","Scopus","2-s2.0-85142700996"
"Haliyur R.; Tong X.; Sanyoura M.; Shrestha S.; Lindner J.; Saunders D.C.; Aramandla R.; Poffenberger G.; Redick S.D.; Bottino R.; Prasad N.; Levy S.E.; Blind R.D.; Harlan D.M.; Philipson L.H.; Stein R.W.; Brissova M.; Powers A.C.","Haliyur, Rachana (55587661000); Tong, Xin (57221665728); Sanyoura, May (25723638700); Shrestha, Shristi (57191895691); Lindner, Jill (7201829707); Saunders, Diane C. (57188997967); Aramandla, Radhika (6506510155); Poffenberger, Greg (8418165400); Redick, Sambra D. (6603213068); Bottino, Rita (7003272775); Prasad, Nripesh (8750090400); Levy, Shawn E. (57207787926); Blind, Raymond D. (8251649400); Harlan, David M. (26540762000); Philipson, Louis H. (35596920400); Stein, Roland W. (7402952705); Brissova, Marcela (6602582034); Powers, Alvin C. (7005770742)","55587661000; 57221665728; 25723638700; 57191895691; 7201829707; 57188997967; 6506510155; 8418165400; 6603213068; 7003272775; 8750090400; 57207787926; 8251649400; 26540762000; 35596920400; 7402952705; 6602582034; 7005770742","Human islets expressing HNF1A variant have defective β cell transcriptional regulatory networks","2019","Journal of Clinical Investigation","129","1","CI121994","","","","59","10.1172/JCI121994","https://www.scopus.com/inward/record.uri?eid=2-s2.0-85058452367&doi=10.1172%2fJCI121994&partnerID=40&md5=978995f6ea53af0960991ffd05df90d9","Department of Molecular Physiology and Biophysics, Vanderbilt University, Nashville, TN, United States; Departments of Medicine and Pediatrics-Endocrinology, Diabetes, and Metabolism, University of Chicago, Chicago, IL, United States; HudsonAlpha Institute for Biotechnology, Huntsville, AL, United States; Division of Diabetes, Endocrinology, and Metabolism, Department of Medicine, Vanderbilt University Medical Center, Nashville, TN, United States; Department of Medicine, Diabetes Center of Excellence, University of Massachusetts Medical School, Worcester, MA, United States; Institute of Cellular Therapeutics, Allegheny Health Network, Pittsburgh, PA, United States; Departments of Pharmacology and Biochemistry, Vanderbilt University, Nashville, TN, United States; Veterans Affairs Tennessee Valley Healthcare System, Nashville, TN, United States","Haliyur R., Department of Molecular Physiology and Biophysics, Vanderbilt University, Nashville, TN, United States; Tong X., Department of Molecular Physiology and Biophysics, Vanderbilt University, Nashville, TN, United States; Sanyoura M., Departments of Medicine and Pediatrics-Endocrinology, Diabetes, and Metabolism, University of Chicago, Chicago, IL, United States; Shrestha S., HudsonAlpha Institute for Biotechnology, Huntsville, AL, United States; Lindner J., Division of Diabetes, Endocrinology, and Metabolism, Department of Medicine, Vanderbilt University Medical Center, Nashville, TN, United States; Saunders D.C., Department of Molecular Physiology and Biophysics, Vanderbilt University, Nashville, TN, United States; Aramandla R., Division of Diabetes, Endocrinology, and Metabolism, Department of Medicine, Vanderbilt University Medical Center, Nashville, TN, United States; Poffenberger G., Division of Diabetes, Endocrinology, and Metabolism, Department of Medicine, Vanderbilt University Medical Center, Nashville, TN, United States; Redick S.D., Department of Medicine, Diabetes Center of Excellence, University of Massachusetts Medical School, Worcester, MA, United States; Bottino R., Institute of Cellular Therapeutics, Allegheny Health Network, Pittsburgh, PA, United States; Prasad N., HudsonAlpha Institute for Biotechnology, Huntsville, AL, United States; Levy S.E., HudsonAlpha Institute for Biotechnology, Huntsville, AL, United States; Blind R.D., Division of Diabetes, Endocrinology, and Metabolism, Department of Medicine, Vanderbilt University Medical Center, Nashville, TN, United States, Departments of Pharmacology and Biochemistry, Vanderbilt University, Nashville, TN, United States; Harlan D.M., Department of Medicine, Diabetes Center of Excellence, University of Massachusetts Medical School, Worcester, MA, United States; Philipson L.H., Departments of Medicine and Pediatrics-Endocrinology, Diabetes, and Metabolism, University of Chicago, Chicago, IL, United States; Stein R.W., Department of Molecular Physiology and Biophysics, Vanderbilt University, Nashville, TN, United States; Brissova M., Division of Diabetes, Endocrinology, and Metabolism, Department of Medicine, Vanderbilt University Medical Center, Nashville, TN, United States; Powers A.C., Department of Molecular Physiology and Biophysics, Vanderbilt University, Nashville, TN, United States, Division of Diabetes, Endocrinology, and Metabolism, Department of Medicine, Vanderbilt University Medical Center, Nashville, TN, United States, Veterans Affairs Tennessee Valley Healthcare System, Nashville, TN, United States","Using an integrated approach to characterize the pancreatic tissue and isolated islets from a 33-year-old with 17 years of type 1 diabetes (T1D), we found that donor islets contained β cells without insulitis and lacked glucose-stimulated insulin secretion despite a normal insulin response to cAMP-evoked stimulation. With these unexpected findings for T1D, we sequenced the donor DNA and found a pathogenic heterozygous variant in the gene encoding hepatocyte nuclear factor- 1α (HNF1A). In one of the first studies of human pancreatic islets with a disease-causing HNF1A variant associated with the most common form of monogenic diabetes, we found that HNF1A dysfunction leads to insulin-insufficient diabetes reminiscent of T1D by impacting the regulatory processes critical for glucose-stimulated insulin secretion and suggest a rationale for a therapeutic alternative to current treatment. © 2019 American Society for Clinical Investigation. All rights reserved.","A.C. Powers; Department of Molecular Physiology and Biophysics, Vanderbilt University, Nashville, United States; email: al.powers@vanderbilt.edu","","American Society for Clinical Investigation","00219738","","JCINA","30507613","English","J. Clin. Invest.","Article","Final","All Open Access; Bronze Open Access; Green Open Access","Scopus","2-s2.0-85058452367"
